id,title,type,description,language,creator_name,creator_role,date_created,date_event,subject,location_name,location_area,location_latitude,location_longitude,format,rights_license,rights_access_level,rights_holder,source_contributor,source_collection,source_original_format,schema_version
b3e7c8a1-4d5f-6e7a-8b9c-0d1e2f3a4b5c,Journey to Dzaleka: A Story of Hope,story,"An oral history account of a Congolese family's journey from Bukavu to Dzaleka Refugee Camp in 2015.",en,Marie Consolée|Jean-Baptiste Mushimiyimana,narrator|interviewer,2024-03-15,2015-08-22,oral history|displacement|Congo|journey|resilience,Dzaleka Refugee Camp,Community Center,-13.7833,33.9833,text/plain,CC-BY-NC-4.0,public,Marie Consolée,Dzaleka Digital Heritage Project,Oral Histories 2024,audio interview (transcribed),1.0.0
a1f2e3d4-5b6c-7d8e-9f0a-1b2c3d4e5f6a,Market Day at Dzaleka,photo,"A vibrant photograph capturing a busy market day at Dzaleka Refugee Camp.",en,Amina Uwase,photographer,2024-06-10,2024-05-18,market|daily life|commerce|community,Dzaleka Refugee Camp,Market Area,-13.7841,33.9827,image/jpeg,CC-BY-4.0,public,Amina Uwase,Dzaleka Youth Media Collective,Camp Life Photography 2024,,1.0.0
c5d6e7f8-9a0b-1c2d-3e4f-5a6b7c8d9e0f,Community School Registration Records 2018,document,"Digitized registration records from the Dzaleka Community Day Secondary School.",en,Dzaleka Community Day Secondary School|Patrick Mwamba,author|editor,2024-01-20,2018-01-15,education|school records|enrollment|demographics,Dzaleka Refugee Camp,Section B,,,application/pdf,CC-BY-NC-4.0,restricted,Dzaleka Community Day Secondary School,Dzaleka Community Day Secondary School,Education Archive,handwritten ledger,1.0.0
d7e8f9a0-b1c2-d3e4-f5a6-b7c8d9e0f1a2,Traditional Songs of the Great Lakes Region,audio,"Field recording of traditional songs performed by Burundian elder women.",rw,Espérance Ndayisaba|Grace Mutoni|Samuel Habimana,narrator|narrator|recorder,2024-04-08,2024-03-22,traditional music|songs|Burundi|cultural heritage|women,Dzaleka Refugee Camp,Community Center,-13.7833,33.9833,audio/mpeg,CC-BY-NC-4.0,community-only,Dzaleka Heritage Audio Archive,Dzaleka Heritage Audio Archive,Traditional Music Archive,live field recording,1.0.0
e9f0a1b2-c3d4-e5f6-a7b8-c9d0e1f2a3b4,World Refugee Day Celebration 2024,event,"Documentation of the World Refugee Day celebration held at Dzaleka on June 20 2024.",en,Dzaleka Cultural Committee|Fatoumata Diallo|Innocent Nshimiyimana,organizer|photographer|author,2024-06-25,2024-06-20,World Refugee Day|celebration|cultural performance|community,Dzaleka Refugee Camp,Main Ground,-13.7833,33.9833,text/html,CC-BY-4.0,public,Dzaleka Cultural Committee,Dzaleka Cultural Committee,Community Events Archive,,1.0.0
